{
  "project_id": "fumoto-growth",
  "artifact_version": "marlin-events-v1",
  "model": {
    "provider": "marlin",
    "model_alias": "NemoStation/Marlin-2B",
    "model_snapshot": "required_for_canonical_runs",
    "connector_version": "marlin-local-v1",
    "inference_mode": "live"
  },
  "items": [
    {
      "asset_id": "AST_01C251D3",
      "source_path": "/Volumes/Extreme 500/動画/麓太朗自転車/IMG_7167.MOV",
      "scene": "A young child wearing a blue ' NASA' t-shirt, tan pants, and a blue full-face helmet is riding a small blue and orange push-bike. The setting is an outdoor dirt path or trail winding through a wooded area with tall pine trees and green grass. The path is uneven with small mounds and turns. In the background, another child on a green bike is briefly visible. The camera follows the child as they navigate the trail, capturing their movements from various angles as they approach, turn, and ride away.",
      "caption": "Scene: A young child wearing a blue ' NASA' t-shirt, tan pants, and a blue full-face helmet is riding a small blue and orange push-bike. The setting is an outdoor dirt path or trail winding through a wooded area with tall pine trees and green grass. The path is uneven with small mounds and turns. In the background, another child on a green bike is briefly visible. The camera follows the child as they navigate the trail, capturing their movements from various angles as they approach, turn, and ride away.\n\nEvents:\n<0.0 - 3.5> The child rides the push-bike toward the camera.\n<3.5 - 5.5> The child turns the bike and rides past the camera.\n<5.5 - 8.5> The child rides the push-bike away down the trail.",
      "events": [
        {
          "event_id": "MEV_AST_01C251D3_0001",
          "start_us": 0,
          "end_us": 3500000,
          "description": "The child rides the push-bike toward the camera.",
          "source_pass": "marlin_caption"
        },
        {
          "event_id": "MEV_AST_01C251D3_0002",
          "start_us": 3500000,
          "end_us": 5500000,
          "description": "The child turns the bike and rides past the camera.",
          "source_pass": "marlin_caption"
        },
        {
          "event_id": "MEV_AST_01C251D3_0003",
          "start_us": 5500000,
          "end_us": 8500000,
          "description": "The child rides the push-bike away down the trail.",
          "source_pass": "marlin_caption"
        }
      ],
      "find_results": [
        {
          "query": "the strongest action moment",
          "span_start_us": 3000000,
          "span_end_us": 4000000,
          "format_ok": true,
          "raw": "From 3.0 to 4.0."
        },
        {
          "query": "the strongest emotional reaction",
          "span_start_us": 3300000,
          "span_end_us": 4000000,
          "format_ok": true,
          "raw": "From 3.3 to 4.0."
        },
        {
          "query": "a clear visual reveal",
          "span_start_us": 3000000,
          "span_end_us": 4000000,
          "format_ok": true,
          "raw": "From 3.0 to 4.0."
        },
        {
          "query": "a person enters or exits",
          "span_start_us": 3000000,
          "span_end_us": 3500000,
          "format_ok": true,
          "raw": "From 3.0 to 3.5."
        }
      ]
    },
    {
      "asset_id": "AST_02DA7FDF",
      "source_path": "/Volumes/Extreme 500/動画/麓太朗自転車/VID_20201024_082154.mov",
      "scene": "A young child wearing a blue helmet and a dark jacket is practicing on a yellow and black balance bike in an outdoor paved area. The setting appears to be a park or a residential courtyard during autumn, with fallen leaves scattered on the ground and trees in the background. The child is attempting to balance on the bike, which has a 'STRIDEK' logo on the handlebars. The camera follows the child's movements, capturing their efforts to maintain balance and eventually fall. The lighting is bright, suggesting a sunny day, with long shadows cast across the patterned stone tiles of the pavement.",
      "caption": "Scene: A young child wearing a blue helmet and a dark jacket is practicing on a yellow and black balance bike in an outdoor paved area. The setting appears to be a park or a residential courtyard during autumn, with fallen leaves scattered on the ground and trees in the background. The child is attempting to balance on the bike, which has a 'STRIDEK' logo on the handlebars. The camera follows the child's movements, capturing their efforts to maintain balance and eventually fall. The lighting is bright, suggesting a sunny day, with long shadows cast across the patterned stone tiles of the pavement.\n\nEvents:\n<0.0 - 6.5> The child balances on the bike while standing.\n<6.5 - 12.5> The child adjusts their grip and balance.\n<12.5 - 16.5> The child turns the bike to the side.\n<16.5 - 21.0> The child loses balance and falls off.\n<21.0 - 24.1> The child stands over the fallen bike.",
      "events": [
        {
          "event_id": "MEV_AST_02DA7FDF_0001",
          "start_us": 0,
          "end_us": 6500000,
          "description": "The child balances on the bike while standing.",
          "source_pass": "marlin_caption"
        },
        {
          "event_id": "MEV_AST_02DA7FDF_0002",
          "start_us": 6500000,
          "end_us": 12500000,
          "description": "The child adjusts their grip and balance.",
          "source_pass": "marlin_caption"
        },
        {
          "event_id": "MEV_AST_02DA7FDF_0003",
          "start_us": 12500000,
          "end_us": 16500000,
          "description": "The child turns the bike to the side.",
          "source_pass": "marlin_caption"
        },
        {
          "event_id": "MEV_AST_02DA7FDF_0004",
          "start_us": 16500000,
          "end_us": 21000000,
          "description": "The child loses balance and falls off.",
          "source_pass": "marlin_caption"
        },
        {
          "event_id": "MEV_AST_02DA7FDF_0005",
          "start_us": 21000000,
          "end_us": 24100000,
          "description": "The child stands over the fallen bike.",
          "source_pass": "marlin_caption"
        }
      ],
      "find_results": [
        {
          "query": "the strongest action moment",
          "span_start_us": 20000000,
          "span_end_us": 21000000,
          "format_ok": true,
          "raw": "From 20.0 to 21.0."
        },
        {
          "query": "the strongest emotional reaction",
          "span_start_us": 21000000,
          "span_end_us": 23000000,
          "format_ok": true,
          "raw": "From 21.0 to 23.0."
        },
        {
          "query": "a clear visual reveal",
          "span_start_us": 21000000,
          "span_end_us": 23000000,
          "format_ok": true,
          "raw": "From 21.0 to 23.0."
        },
        {
          "query": "a person enters or exits",
          "span_start_us": 22000000,
          "span_end_us": 23000000,
          "format_ok": true,
          "raw": "From 22.0 to 23.0."
        }
      ]
    },
    {
      "asset_id": "AST_0C9FA88A",
      "source_path": "/Volumes/Extreme 500/動画/麓太朗自転車/IMG_6645.MOV",
      "scene": "A young child stands in a grassy field next to a dense patch of golden rice. The child is wearing a wide-brimmed green sun hat, a light-colored short-sleeved shirt, and striped pants. In the background, a vast mountain range with snow-capped peaks is visible under a clear blue sky. A paved road runs along the right side of the frame, and a few distant buildings are visible on the horizon. The lighting is bright and sunny, suggesting a clear day. The camera remains relatively stable, capturing the child's movements as they interact with the environment and the camera.",
      "caption": "Scene: A young child stands in a grassy field next to a dense patch of golden rice. The child is wearing a wide-brimmed green sun hat, a light-colored short-sleeved shirt, and striped pants. In the background, a vast mountain range with snow-capped peaks is visible under a clear blue sky. A paved road runs along the right side of the frame, and a few distant buildings are visible on the horizon. The lighting is bright and sunny, suggesting a clear day. The camera remains relatively stable, capturing the child's movements as they interact with the environment and the camera.\n\nEvents:\n<0.0 - 1.0> The child stands still looking toward the right.\n<1.0 - 2.5> The child turns their head to face the camera.\n<2.5 - 4.0> The child leans forward and steps into the grass.",
      "events": [
        {
          "event_id": "MEV_AST_0C9FA88A_0001",
          "start_us": 0,
          "end_us": 1000000,
          "description": "The child stands still looking toward the right.",
          "source_pass": "marlin_caption"
        },
        {
          "event_id": "MEV_AST_0C9FA88A_0002",
          "start_us": 1000000,
          "end_us": 2500000,
          "description": "The child turns their head to face the camera.",
          "source_pass": "marlin_caption"
        },
        {
          "event_id": "MEV_AST_0C9FA88A_0003",
          "start_us": 2500000,
          "end_us": 4000000,
          "description": "The child leans forward and steps into the grass.",
          "source_pass": "marlin_caption"
        }
      ],
      "find_results": [
        {
          "query": "the strongest action moment",
          "span_start_us": 2000000,
          "span_end_us": 3000000,
          "format_ok": true,
          "raw": "From 2.0 to 3.0."
        },
        {
          "query": "the strongest emotional reaction",
          "span_start_us": 0,
          "span_end_us": 1000000,
          "format_ok": true,
          "raw": "From 0.0 to 1.0."
        },
        {
          "query": "a clear visual reveal",
          "span_start_us": 0,
          "span_end_us": 4000000,
          "format_ok": true,
          "raw": "From 0.0 to 4.0."
        },
        {
          "query": "a person enters or exits",